,ID,title,music_director,album_name,track_name,preview_url,popularity,acousticness,danceability,energy,tempo,valence,instrumentalness,liveness,loudness,speechiness
0,1,Inception,Hans Zimmer,Inception (Music From The Motion Picture),Time,https://p.scdn.co/mp3-preview/eb463247243646de10aa4d9b3f2c0c8b836c1dc8?cid=0e18970867524f1fba6634279dd9e5b2,73,0.155,0.221,0.0879,126.622,0.0401,0.698,0.0869,-16.996,0.0381
1,2,The Matrix,Don Davis,The Matrix Symphony,The Matrix Symphony: 1. The Matrix,https://p.scdn.co/mp3-preview/246d8c1287fa0ffc6c16f517ff95c793eb664033?cid=0e18970867524f1fba6634279dd9e5b2,9,0.881,0.091,0.279,76.256,0.0372,0.916,0.105,-16.499,0.0412
2,3,Avengers: Infinity War,Alan Silvestri,Avengers: Infinity War (Original Motion Picture Soundtrack / Deluxe Edition),Porch,,53,0.912,0.127,0.0355,65.659,0.0834,0.594,0.119,-28.803,0.0447
3,4,Back to the Future,Alan Silvestri,"Suite (From ""Back to the Future"")","Suite (From ""Back to the Future"")",https://p.scdn.co/mp3-preview/6ea6ffaf6fdbda4465fa72252d2a3cf4fe827f42?cid=0e18970867524f1fba6634279dd9e5b2,25,0.87,0.197,0.499,79.723,0.148,0.776,0.0398,-9.874,0.0581
4,5,"The Good, the Bad and the Ugly",Ennio Morricone,"The Good, the Bad and the Ugly","The Good, the Bad and the Ugly",https://p.scdn.co/mp3-preview/877d06cb3206d0b98aaab6c9bc4e71b662cf10ee?cid=0e18970867524f1fba6634279dd9e5b2,0,0.971,0.776,0.106,119.929,0.155,0.765,0.0825,-17.246,0.0794
5,6,Spider-Man: Into the Spider-Verse,Daniel Pemberton,Spider-Man: Into the Spider-Verse (Original Score),Only One Spider-Man,https://p.scdn.co/mp3-preview/28965d0966346e245c6398ac43e708dd25f06663?cid=0e18970867524f1fba6634279dd9e5b2,50,0.00148,0.635,0.686,145.101,0.713,0.933,0.0684,-10.361,0.0887
6,9,Raiders of the Lost Ark,John Williams,Raiders of the Lost Ark (Original Motion Picture Soundtrack),Washington Ending / Raiders March,,38,0.813,0.31,0.346,131.117,0.152,0.91,0.107,-11.232,0.0392
8,11,Taxi Driver,Bernard Herrmann,Bernard Herrman Films Scores (From Citizen Kane to Taxi Driver),"Medley: Prelude / The Murder / Finale - From ""Psycho""",https://p.scdn.co/mp3-preview/571e3043451b70007dda26f5bc9b2f39de735cb8?cid=0e18970867524f1fba6634279dd9e5b2,21,0.877,0.236,0.0113,89.751,0.0374,0.3,0.0789,-31.226,0.0439
9,12,3 Idiots,Shantanu Moitra,3 Idiots (Original Motion Picture Soundtrack),Give Me Some Sunshine,https://p.scdn.co/mp3-preview/513293ff19829e189fa2ecda713a0cee28263cb2?cid=0e18970867524f1fba6634279dd9e5b2,60,0.393,0.668,0.616,97.986,0.566,6.31E-06,0.092,-7.925,0.0582
10,13,Pan's Labyrinth,Javier Navarrete,Pan's Labyrinth (Original Motion Picture Soundtrack),Pan's Labyrinth Lullaby,https://p.scdn.co/mp3-preview/f84421925786b272ee7f5538ba61277e7fcb09f6?cid=0e18970867524f1fba6634279dd9e5b2,45,0.89,0.284,0.0863,70.79,0.0796,0.0889,0.0803,-20.316,0.0428
11,14,Room,Stephen Rennicks,Room (Original Motion Picture Soundtrack),In the World,https://p.scdn.co/mp3-preview/e6f573a949e7eaad1b1a75d26c1409adc979c74f?cid=0e18970867524f1fba6634279dd9e5b2,25,0.987,0.109,0.104,70.956,0.117,0.903,0.0926,-14.72,0.0338
12,17,Indiana Jones and the Last Crusade,John Williams,Indiana Jones and the Last Crusade (Original Motion Picture Soundtrack),Scherzo for Motorcycle and Orchestra,,36,0.908,0.445,0.511,92.212,0.325,0.917,0.156,-10.056,0.0408
14,19,The King's Speech,Alexandre Desplat,The King's Speech OST,Speaking Unto Nations (Beethoven Symphony no 7 - II ),,52,0.513,0.093,0.0249,79.369,0.0365,0.805,0.0831,-20.74,0.0463
15,20,Her,Arcade Fire,Her (Original Score),Song on the Beach,https://p.scdn.co/mp3-preview/d512ea83592df88a3539deaffebb4190a764257c?cid=0e18970867524f1fba6634279dd9e5b2,54,0.986,0.599,0.00379,131.623,0.326,0.924,0.101,-31.414,0.0644
16,21,There Will Be Blood,Jonny Greenwood,There Will Be Blood (Music from the Motion Picture),Open Spaces,https://p.scdn.co/mp3-preview/895b784af6e0af2a603320b4ecd5280e54f13c10?cid=0e18970867524f1fba6634279dd9e5b2,31,0.95,0.204,0.177,66.12,0.0366,0.875,0.111,-16.339,0.0428
17,22,The Social Network,Trent Reznor,The Social Network,Hand Covers Bruise,https://p.scdn.co/mp3-preview/578eb91d392f872333f6d6964bf6f68147c99715?cid=0e18970867524f1fba6634279dd9e5b2,51,0.971,0.204,0.154,114.21,0.0389,0.945,0.103,-25.379,0.0421
18,24,The Perks of Being a Wallflower,Michael Brook,The Perks of Being a Wallflower (Original Score),Home Again,https://p.scdn.co/mp3-preview/8e4faa124d94a9c6fd521a2f68b00de9efd7a1f5?cid=0e18970867524f1fba6634279dd9e5b2,37,0.987,0.261,0.108,174.106,0.139,0.977,0.209,-17.865,0.0387
20,26,Ex Machina,Geoff Barrow,Ex Machina (Original Motion Picture Soundtrack),The Turing Test,https://p.scdn.co/mp3-preview/3d7f93b49fc6d9c971917c3e6d7253f87f95227a?cid=0e18970867524f1fba6634279dd9e5b2,41,0.96,0.194,0.0436,138.908,0.0294,0.899,0.105,-31.458,0.039
21,27,Silver Linings Playbook,Danny Elfman,Silver Linings Playbook (Original Score),Happy Ending,https://p.scdn.co/mp3-preview/2c242d08f79d58c4c2c530399540a12c274aeae8?cid=0e18970867524f1fba6634279dd9e5b2,27,0.862,0.369,0.331,99.924,0.201,0.948,0.0925,-14.678,0.032
22,28,District 9,Clinton Shorter,District 9 (Original Motion Picture Soundtrack),Prawnkus,https://p.scdn.co/mp3-preview/dc6c8687518893e94b2ddd65bb500323d94c534b?cid=0e18970867524f1fba6634279dd9e5b2,43,0.923,0.164,0.0933,129.94,0.0321,0.87,0.109,-22.457,0.04
23,30,Moon,Clint Mansell,Moon (Original Score),Welcome to Lunar Industries,https://p.scdn.co/mp3-preview/8cb269eff5e12d893c06f7644ec0e675037d73ce?cid=0e18970867524f1fba6634279dd9e5b2,48,0.88,0.272,0.284,111.642,0.0364,0.892,0.121,-17.183,0.0349
24,31,Marriage Story,Randy Newman,Marriage Story (Original Music from the Netflix Film),Sgt. Pepper Shoelaces,https://p.scdn.co/mp3-preview/a8c7a9bac7391a6f9dcf6ab8115870ccba74b1b8?cid=0e18970867524f1fba6634279dd9e5b2,40,0.995,0.536,0.0397,83.998,0.502,0.961,0.108,-22.138,0.0511
25,32,Drive,Cliff Martinez,I Drive (Waveshaper Remix) [The Rise of the Synths Presents],I Drive (Waveshaper Remix) [The Rise of the Synths Presents],https://p.scdn.co/mp3-preview/9bb8cc30f829e94bfb685fa0842d67fe82f228ae?cid=0e18970867524f1fba6634279dd9e5b2,17,0.016,0.273,0.903,192.587,0.0784,0.0381,0.0998,-6.116,0.106
27,34,Incredibles 2,Michael Giacchino,Incredibles 2 (Original Motion Picture Soundtrack),Incredits 2,,25,0.524,0.446,0.606,123.773,0.182,0.13,0.873,-8.338,0.0931
28,35,Dangal,Pritam Chakraborty,Dangal (Original Motion Picture Soundtrack),Naina,https://p.scdn.co/mp3-preview/534433be09560f3876589e986fc628de0c4b4b30?cid=0e18970867524f1fba6634279dd9e5b2,64,0.772,0.501,0.445,80.086,0.388,0,0.117,-8.432,0.0337
30,37,Minority Report,John Williams,Minority Report,Sean's Theme - Minority Report Soundtrack,,16,0.937,0.14,0.0129,69.879,0.126,0.899,0.153,-33.012,0.0365
33,41,Despicable Me,Heitor Pereira,Despicable Me 3 (Original Motion Picture Score),Evil Bratt Show,https://p.scdn.co/mp3-preview/edde11e572d728870073cc23706715e9abcf1c13?cid=0e18970867524f1fba6634279dd9e5b2,15,0.00172,0.556,0.542,146.922,0.34,0.249,0.364,-12.308,0.0509
37,45,Indiana Jones and the Temple of Doom,John Williams,Indiana Jones and the Temple of Doom (Original Motion Picture Soundtrack),End Credits,,32,0.708,0.194,0.406,180.159,0.305,0.602,0.114,-12.646,0.042
39,48,Senna,Antonio Pinto,Original Music From The Motion Picture Senna,God - Senna Theme,,34,0.491,0,0.194,0,0,0.881,0.112,-19.114,0
42,51,The Hateful Eight,Ennio Morricone,The Hateful Eight Overture,"Overture (From ""The Hateful Eight"" Soundtrack)",https://p.scdn.co/mp3-preview/2ec35a0e6e4557d7bc91263ec8b6a0664ee880eb?cid=0e18970867524f1fba6634279dd9e5b2,10,0.862,0.346,0.253,82.442,0.0366,0.951,0.0807,-14.204,0.0461
48,59,Snowpiercer,Marco Beltrami,Snowpiercer (Original Motion Picture Soundtrack),Sushi,,18,0.996,0.363,0.00498,168.621,0.19,0.931,0.0648,-32.216,0.0479
49,60,Hugo,Howard Shore,Hugo Original Score,The Thief,https://p.scdn.co/mp3-preview/ff6c7ef30e85293597c95030e0b2c5016c732f5a?cid=0e18970867524f1fba6634279dd9e5b2,31,0.723,0.253,0.109,113.484,0.0894,0.641,0.0721,-21.238,0.0355
56,67,Molly's Game,Daniel Pemberton,Molly's Game (Original Motion Picture Soundtrack),Molly's Dream,https://p.scdn.co/mp3-preview/6ae546ba254951ff2e14f61fc3544365d71173fa?cid=0e18970867524f1fba6634279dd9e5b2,22,0.988,0.277,0.000637,72.709,0,0.903,0.0964,-33.8,0.0521
57,69,El Camino: A Breaking Bad Movie,Dave Porter,"Underpass / Frozen Money (from ""El Camino: A Breaking Bad Movie"")",Underpass,https://p.scdn.co/mp3-preview/09e64976585c043038ac7cd31df469da7b1bb7e8?cid=0e18970867524f1fba6634279dd9e5b2,4,0.948,0.305,0.0424,100.143,0.0364,0.774,0.084,-26.35,0.0323
58,72,End of Watch,David Sardy,End of Watch,Funeral,https://p.scdn.co/mp3-preview/525e814ad8b37c4bde30ae465663a2aa0422b111?cid=0e18970867524f1fba6634279dd9e5b2,16,0.915,0.568,0.186,109.093,0.0373,0.948,0.0668,-15.746,0.0322
63,79,Mud,David Wingo,Mud (Original Motion Picture Soundtrack),Sleeping in Trees,https://p.scdn.co/mp3-preview/a12130dc8bbc07b60b1af0dfc181b6b299bc1484?cid=0e18970867524f1fba6634279dd9e5b2,3,0.929,0.285,0.347,170.449,0.0392,0.661,0.101,-16.019,0.0466
67,85,The Two Popes,Bryce Dessner,The Two Popes (Music from the Netflix Film),Walls 2,https://p.scdn.co/mp3-preview/b67e663e244a2314c374ea1f1ee911f34d177f8a?cid=0e18970867524f1fba6634279dd9e5b2,30,0.963,0.335,0.0688,52.025,0.278,0.843,0.124,-26.686,0.0406
68,86,The Last Samurai,Hans Zimmer,The Last Samurai: Original Motion Picture Score,A Way of Life,https://p.scdn.co/mp3-preview/53eaa9f8b2437bbb727892962fa8862f1c2f8052?cid=0e18970867524f1fba6634279dd9e5b2,57,0.895,0.0923,0.031,86.636,0.0344,0.916,0.0766,-29.351,0.0454
72,91,Dolemite Is My Name,Scott Bomar,Dolemite Is My Name (Music from the Netflix Film),Like I Should,https://p.scdn.co/mp3-preview/a622e71ddbfbe88a6578e90b4eb70f461ffeeb70?cid=0e18970867524f1fba6634279dd9e5b2,18,0.0783,0.711,0.774,102.542,0.885,1.60E-06,0.0446,-5.686,0.0389
73,92,Tarzan,David Newman,Tarzan (Original Motion Picture Soundtrack),Loud Like Love,https://p.scdn.co/mp3-preview/9c2fb266771c5251957d2f9b77c6ac9a22287c8f?cid=0e18970867524f1fba6634279dd9e5b2,9,0.00016,0.402,0.944,152.971,0.368,6.91E-06,0.114,-4.732,0.0559
76,96,Saving Mr. Banks,Thomas Newman,Saving Mr. Banks (Original Motion Picture Soundtrack/Deluxe Edition/Japan Release Version),Saving Mr. Banks (End Title),,11,0.957,0.309,0.281,105.878,0.103,0.271,0.0815,-12.746,0.0312
77,97,Icarus,Adam Peters,Icarus (Original Motion Picture Soundtrack),Icarus Ending,https://p.scdn.co/mp3-preview/179b3d4df84d93c254e5e27d219d0d0540d61799?cid=0e18970867524f1fba6634279dd9e5b2,22,0.973,0.486,0.361,106.141,0.339,0.93,0.0883,-16.829,0.0288
80,101,The Death of Stalin,Christopher Willis,The Death of Stalin (Original Motion Picture Soundtrack),"Moscow, 1953",https://p.scdn.co/mp3-preview/ea5df6d32967c37936aabfd0943f277d30c8d7c2?cid=0e18970867524f1fba6634279dd9e5b2,0,0.847,0.42,0.257,99.984,0.0643,0.887,0.097,-14.524,0.0366
86,113,Extraction,Ryan Dodson,Extraction (Original Motion Picture Soundtrack),The Agent,https://p.scdn.co/mp3-preview/38e0c4a99533d5d545da64ba67238fa1607dcaea?cid=0e18970867524f1fba6634279dd9e5b2,1,0.193,0.25,0.677,96.032,0.034,0.843,0.172,-14.26,0.0389
88,115,Blue Valentine,Grizzly Bear,Blue Valentine (Original Motion Picture Soundtrack),Granny Diner,https://p.scdn.co/mp3-preview/8340eacc50750ce9407f06ccec49b55e7c97ea6c?cid=0e18970867524f1fba6634279dd9e5b2,16,0.916,0.259,0.129,93.626,0.0398,0.684,0.388,-18.872,0.0371
90,117,Green Room,Will Blair,Green Room (Original Motion Picture Soundtrack),"Nazi Punks, Fuck Off",https://p.scdn.co/mp3-preview/0093c50dd05d72a20b856361594bb5defeb7813d?cid=0e18970867524f1fba6634279dd9e5b2,4,9.96E-05,0.248,0.995,150.708,0.429,0,0.53,-4.816,0.183
91,118,Kung Fu Panda 2,John Powell,Kung Fu Panda 2 (Music From The Motion Picture),Po Finds The Truth,,30,0.511,0.171,0.214,62.568,0.0393,0.587,0.0982,-16.396,0.0372
92,119,The Ballad of Buster Scruggs,Carter Burwell,The Ballad of Buster Scruggs (Original Motion Picture Soundtrack),When A Cowboy Trades His Spurs For Wings,https://p.scdn.co/mp3-preview/792a1d2a011109f68cbccad8365f1a631f0e19d5?cid=0e18970867524f1fba6634279dd9e5b2,29,0.819,0.575,0.226,135.361,0.478,0,0.121,-12.637,0.0365
93,122,The Adventures of Tintin,John Williams,The Adventures of Tintin,The Adventures of Tintin,https://p.scdn.co/mp3-preview/e8e6ecd4964012956e97e7ab30508b5ee47e2423?cid=0e18970867524f1fba6634279dd9e5b2,31,0.741,0.634,0.118,133.856,0.474,0.748,0.214,-22.22,0.0351
101,137,Solo: A Star Wars Story,John Powell,Solo: A Star Wars Story (Original Motion Picture Soundtrack/Deluxe Edition),Meet Han (1M1),,24,0.21,0.196,0.394,130.899,0.0392,0.945,0.105,-16.016,0.0639
102,138,Steve Jobs,Daniel Pemberton,Steve Jobs (Original Motion Picture Soundtrack),The Skylab Plan,https://p.scdn.co/mp3-preview/93bc73c4ef67888d3e37b1d20e359bab31f3da84?cid=0e18970867524f1fba6634279dd9e5b2,29,0.215,0.526,0.492,90.006,0.199,0.862,0.0762,-11.677,0.0324
103,140,The Croods,Alan Silvestri,The Croods (Original Motion Picture Soundtrack),Shine Your Way,https://p.scdn.co/mp3-preview/7927c803afff53657dda54bdc7b6b1a27f080887?cid=0e18970867524f1fba6634279dd9e5b2,0,0.00796,0.694,0.443,120.019,0.642,0,0.0731,-8.136,0.0456
104,141,Locke,Dickon Hinchliffe,Locke (The Original Motion Picture Soundtrack),Baby,,22,0.324,0.44,0.27,125.969,0.039,0.927,0.164,-15.21,0.0376
105,143,Starred Up,Tony Doogan,Starred Up (Original Motion Picture Soundtrack),End Piece,https://p.scdn.co/mp3-preview/1b3c23d456df39ece65f3a87ca47ac5909a438cd?cid=0e18970867524f1fba6634279dd9e5b2,9,0.171,0.481,0.464,103.97,0.168,0.163,0.13,-9.392,0.0256
106,144,Mudbound,Tamar-kali,Mudbound (Original Motion Picture Soundtrack),Mighty River,https://p.scdn.co/mp3-preview/bc9e86c9bc559079bb12ae0c9eb8b10e00317580?cid=0e18970867524f1fba6634279dd9e5b2,19,0.479,0.276,0.261,73.174,0.322,0,0.158,-13.47,0.0475
108,146,Blue Ruin,Brooke Blair,Blue Ruin (Original Score),Bad News,https://p.scdn.co/mp3-preview/5847ca8abb162e511cac956630c845d6e8862deb?cid=0e18970867524f1fba6634279dd9e5b2,5,0.988,0.135,0.00168,141.561,0.0372,0.957,0.135,-26.908,0.0708
112,155,Haider,Vishal Bhardwaj,Haider - Original Background Score,Haider Theme,https://p.scdn.co/mp3-preview/21c5692cb1add3720c63ad52d62cd4ad0b0572a9?cid=0e18970867524f1fba6634279dd9e5b2,5,0.972,0.27,0.105,89.963,0.0313,0.963,0.0745,-16.279,0.0378
113,157,Hush,The Newton Brothers,Hush (Original Motion Picture Soundtrack),Against the Odds (End Credits),https://p.scdn.co/mp3-preview/5a36d2f96a7fa4128f372a086a341d418e0fd887?cid=0e18970867524f1fba6634279dd9e5b2,15,0.567,0.2,0.191,119.905,0.0398,0.738,0.115,-18.767,0.0363
114,158,Elizabeth,David Hirschfelder,Elizabeth - Original Soundtrack,Dansereye (1551): Rondes I & VII,,22,0.935,0.551,0.0551,128.569,0.734,0.155,0.152,-32.128,0.0352
118,164,The Autopsy of Jane Doe,Danny Bensi,The Autopsy of Jane Doe (Original Motion Picture Soundtrack),Jane Doe,https://p.scdn.co/mp3-preview/ec2f27ad6aea7b1fd8fc2154a77b90109242bb78?cid=0e18970867524f1fba6634279dd9e5b2,13,0.688,0.126,0.0967,147.773,0.0388,0.893,0.105,-24.686,0.0393
119,165,Virunga,Patrick Jonsson,Virunga (Original Motion Picture Soundtrack),Virunga National Park,,10,0.97,0.424,0.252,130.111,0.0359,0.917,0.103,-15.392,0.0346
121,167,The Master,Jonny Greenwood,The Master: Original Motion Picture Soundtrack,No Other Love (feat. Jo Stafford),https://p.scdn.co/mp3-preview/603d84b0e067c1b39a3876506dd28336bfd34976?cid=0e18970867524f1fba6634279dd9e5b2,37,0.975,0.418,0.0585,98.185,0.236,0.00287,0.115,-15.772,0.0329
122,168,A Serious Man,Carter Burwell,A Serious Man (Original Motion Picture Soundtrack),A Serious Man,https://p.scdn.co/mp3-preview/f191d6daaf4f847e1ef1aec01843db4264516a17?cid=0e18970867524f1fba6634279dd9e5b2,14,0.823,0.238,0.105,156.519,0.0754,0.671,0.096,-20.754,0.0388
123,170,The Breadwinner,Mychael Danna,The Breadwinner (Original Motion Picture Soundtrack),The Land of the Noble,https://p.scdn.co/mp3-preview/d019f038affc36a8aa1abd9cad81cc395d97ceec?cid=0e18970867524f1fba6634279dd9e5b2,13,0.497,0.636,0.296,120,0.0695,0.968,0.132,-16.046,0.0346
124,171,The Boy Who Harnessed the Wind,Antonio Pinto,窯ⓦ굮?ㅳ걢?얇걟?잌컩亮?(The Boy Who Harnessed the Wind) [Original Soundtrack],訝??겎,https://p.scdn.co/mp3-preview/8a1a4ae630e27a6e6d10f16a2a5d99d8acd4b2a4?cid=0e18970867524f1fba6634279dd9e5b2,0,0.676,0.163,0.32,85.258,0.0339,0.579,0.127,-14.166,0.0397
126,174,Lawless,Nick Cave,Lawless,"Fire in the Blood / Snake Song (feat. Emmylou Harris, feat. Ralph Stanley)",https://p.scdn.co/mp3-preview/00d8b1136d9a5e8176d3b4adfa39da1a984a22ab?cid=0e18970867524f1fba6634279dd9e5b2,36,0.641,0.32,0.172,150.979,0.163,0.0017,0.192,-11.935,0.0301
129,179,The Mask of Zorro,James Horner,The Mask of Zorro - Music from the Motion Picture,Quiero Vivir La Vida Amandote,https://p.scdn.co/mp3-preview/4ed180b6394d4745fa03be2b548a35f336f12c37?cid=0e18970867524f1fba6634279dd9e5b2,21,0.614,0.4,0.469,107.621,0.146,0,0.339,-11.27,0.0331
130,180,The Natural,Randy Newman,The Natural,The Natural,https://p.scdn.co/mp3-preview/1621792878dde40765aa4f5d8986e1f83f5cbffe?cid=0e18970867524f1fba6634279dd9e5b2,22,0.192,0.201,0.263,77.416,0.165,5.99E-05,0.0999,-17.928,0.0331
132,182,Arthur Christmas,Harry Gregson-Williams,Arthur Christmas - Original Motion Picture Soundtrack,Make Someone Happy,https://p.scdn.co/mp3-preview/2fade0d47abac494bd7eaade5efe26a6e50e2851?cid=0e18970867524f1fba6634279dd9e5b2,33,0.616,0.382,0.434,114.068,0.484,2.88E-06,0.0455,-10.688,0.0356
135,187,War Horse,John Williams,War Horse,The Reunion,https://p.scdn.co/mp3-preview/23c0bf7032ee7bdf1ac4500f8d9ffc3e9f8dff8b?cid=0e18970867524f1fba6634279dd9e5b2,37,0.981,0.144,0.0298,102.489,0.0342,0.921,0.174,-27.002,0.0429
137,190,A Most Violent Year,Alex Ebert,A Most Violent Year (Original Music From and Inspired By),America For Me,https://p.scdn.co/mp3-preview/99288b5f1852e300c85e0e478535bd47e6ee0229?cid=0e18970867524f1fba6634279dd9e5b2,16,0.785,0.442,0.239,154.132,0.19,0.578,0.115,-16.335,0.112
140,195,Insidious,Joseph Bishara,Insidious: Chapter 3 (Original Motion Picture Score),visit from Light,https://p.scdn.co/mp3-preview/e0b94c49bacac01d37c4c31b007d25c55feeb8a5?cid=0e18970867524f1fba6634279dd9e5b2,12,0.00764,0.164,0.416,86.464,0.0354,0.795,0.096,-12.763,0.0366
141,198,The Foreigner,Cliff Martinez,The Foreigner (Original Motion Picture Soundtrack),Landscape Gardener - OMPS Edit,https://p.scdn.co/mp3-preview/76a6fc59a57951fdcd1567d3e2535a3cb07f7ac9?cid=0e18970867524f1fba6634279dd9e5b2,17,0.493,0.416,0.546,180.044,0.0336,0.936,0.087,-11.812,0.0522
142,199,The Danish Girl,Alexandre Desplat,The Danish Girl (Original Motion Picture Soundtrack),The Danish Girl,,52,0.933,0.189,0.18,102.497,0.0569,0.577,0.259,-18.694,0.0326
144,201,Bird Box,Trent Reznor,Bird Box (Abridged) [Original Score],Undercurrents,https://p.scdn.co/mp3-preview/8c91f04688142957fffcdb8f520eb060c4efe148?cid=0e18970867524f1fba6634279dd9e5b2,19,0.782,0.188,0.468,114.146,0.0367,0.925,0.0823,-9.132,0.0447
145,203,Hostiles,Max Richter,Hostiles (Original Motion Picture Soundtrack),Never Goodbye,,38,0.513,0.135,0.0233,63.008,0.0352,0.909,0.0601,-16.648,0.0429
146,206,LA 92,Danny Bensi,LA 92 (Original Soundtrack Album),Looting,https://p.scdn.co/mp3-preview/04cd90176531ed7a8f692bfa8d7cf4d3a06eb248?cid=0e18970867524f1fba6634279dd9e5b2,7,0.956,0.847,0.0552,122.068,0.0411,0.904,0.0919,-23.604,0.0688
150,211,A Ghost Story,Daniel Hart,A Ghost Story (Original Motion Picture Soundtrack),I Get Overwhelmed,https://p.scdn.co/mp3-preview/d29537c6934fa33808418f7069495d38cd8d5e95?cid=0e18970867524f1fba6634279dd9e5b2,21,0.662,0.226,0.512,78.624,0.25,0.000616,0.136,-9.404,0.054
151,212,United 93,John Powell,United 93 (Original Motion Picture Soundtrack),The End,,16,0.0738,0.0953,0.372,179.421,0.0503,0.755,0.0972,-16.812,0.0411
155,217,Enemy,Danny Bensi,Enemy (Original Soundtrack Album),The Dark Room,https://p.scdn.co/mp3-preview/90093aaf1c0850117f37901718b6baec7ff47041?cid=0e18970867524f1fba6634279dd9e5b2,13,0.608,0.154,0.162,75.174,0.034,0.877,0.0947,-18.942,0.0416
157,220,Indiana Jones and the Kingdom of the Crystal Skull,John Williams,Indiana Jones and the Kingdom of the Crystal Skull (Original Motion Picture Soundtrack),Raiders March,,54,0.73,0.422,0.351,132.317,0.168,0.904,0.0784,-13.002,0.0352
163,227,Angel Has Fallen,David Buckley,Angel Has Fallen (Original Motion Picture Soundtrack),No More Secrets,https://p.scdn.co/mp3-preview/d181bca86a1c8008af298dd0f258cb189f02b61b?cid=0e18970867524f1fba6634279dd9e5b2,9,0.548,0.159,0.145,75.425,0.0315,0.832,0.0853,-16.816,0.0374
165,229,Mary Poppins Returns,Marc Shaiman,Disney Sing-Along: Mary Poppins Returns,A Conversation,,23,0.973,0.256,0.017,111.302,0.106,0.0544,0.0961,-29.288,0.0407
169,235,American Factory,Chad Cannon,American Factory (A Netflix Original Documentary Soundtrack),The Chill in This Air,https://p.scdn.co/mp3-preview/ba22627fea09ffffb2d2290e4291fa4d0a5d810f?cid=0e18970867524f1fba6634279dd9e5b2,8,0.567,0.2,0.134,122.191,0.0471,0.974,0.107,-17.548,0.0429
170,236,Code 8,Ryan Taubert,Code 8 (Original Motion Picture Soundtrack),Drifting,https://p.scdn.co/mp3-preview/c508ee8f9b650ef1a9ee465e2d6bebcd16684722?cid=0e18970867524f1fba6634279dd9e5b2,40,0.845,0.541,0.252,101.825,0.302,0.000383,0.165,-15.109,0.0322
171,237,Salt,James Newton Howard,Salt (Original Motion Picture Score),Go Get Em,https://p.scdn.co/mp3-preview/e9c231278c208f1427354c038965bef9b93e5c5b?cid=0e18970867524f1fba6634279dd9e5b2,12,0.015,0.53,0.49,90.395,0.0777,0.95,0.0983,-15.367,0.0357
172,238,The Hundred-Foot Journey,A.R. Rahman,The Hundred-Foot Journey (Original Motion Picture Soundtrack),Afreen,,27,0.0594,0.591,0.8,101,0.404,6.11E-05,0.192,-6.972,0.0725
173,241,Chasing Coral,Saul Simon MacWilliams,Chasing Coral (Original Motion Picture Soundtrack),Tell Me How Long,https://p.scdn.co/mp3-preview/c167f83f632ee9dc4edee1107979beb298756726?cid=0e18970867524f1fba6634279dd9e5b2,30,0.0617,0.378,0.612,76.74,0.27,0,0.105,-6.282,0.0403
175,243,The One I Love,Danny Bensi,The One I Love (Original Motion Picture Soundtrack),The Arrival,https://p.scdn.co/mp3-preview/9664dd4b24011f690ad54196723528171e41ef4d?cid=0e18970867524f1fba6634279dd9e5b2,1,0.939,0.462,0.0904,97.951,0.0338,0.826,0.117,-23.027,0.0364
178,249,The Willoughbys,Mark Mothersbaugh,The Willoughbys (Music from the Netflix Film),The Willoughby Boogie,https://p.scdn.co/mp3-preview/e878fa20f1265e5e30338053e469ff3464d376c6?cid=0e18970867524f1fba6634279dd9e5b2,23,0.383,0.777,0.338,170.286,0.801,0.888,0.103,-11.341,0.0684
179,250,The White Helmets,Patrick Jonsson,The White Helmets (Original Motion Picture Soundtrack),Hope,https://p.scdn.co/mp3-preview/37f6ad04025034b5def3a1cc3e965a37a565b73d?cid=0e18970867524f1fba6634279dd9e5b2,21,0.816,0.145,0.23,78.309,0.0327,0.941,0.0771,-17.905,0.0408
184,258,The Battered Bastards of Baseball,Brocker Way,The Battered Bastards of Baseball,Man with a Broom (Make Us a Show),https://p.scdn.co/mp3-preview/4e46d25655423f7c1b6a1edd20c44b1a05c6737b?cid=0e18970867524f1fba6634279dd9e5b2,14,0.689,0.344,0.482,171.896,0.16,0,0.112,-8.685,0.047
187,261,Sinister,Christopher Young,Sinister (Original Motion Picture Soundtrack),Sinister,,22,0.72,0.482,0.533,127.983,0.157,0.913,0.46,-9.209,0.058
188,264,The Stanford Prison Experiment,Andrew Hewitt,The Stanford Prison Experiment (Original Motion Picture Soundtrack),Opening Titles,https://p.scdn.co/mp3-preview/cf614e7361b9951fe77d6df03e6e3e5d7a82b8f1?cid=0e18970867524f1fba6634279dd9e5b2,1,0.918,0.608,0.61,124.982,0.162,0.877,0.0887,-10.922,0.0335
189,265,My Week with Marilyn,Conrad Pope,My Week with Marilyn,Marilyn's Theme,https://p.scdn.co/mp3-preview/dcc87d83d218a10d0bcea41d968aea745f1e0b1d?cid=0e18970867524f1fba6634279dd9e5b2,30,0.991,0.56,0.00767,66.384,0.206,0.915,0.0737,-24.558,0.0538
191,267,Secret Superstar,Amit Trivedi,Secret Superstar,Nachdi Phira,https://p.scdn.co/mp3-preview/ea89da31583119ccd608924639bc5ad4bcd4609f?cid=0e18970867524f1fba6634279dd9e5b2,50,0.535,0.421,0.46,171.845,0.208,0,0.101,-6.044,0.0344
193,269,Jarhead,Thomas Newman,Jarhead,Welcome To The Suck,,25,0.0181,0.632,0.619,171.115,0.256,0.88,0.367,-11.486,0.131
198,275,Olympus Has Fallen,Trevor Morris,Olympus Has Fallen (Music from the Motion Picture),Day Break / We Will Rise / End Credits,,22,0.425,0.0784,0.267,82.689,0.0463,0.953,0.103,-14.261,0.033
204,288,The Score,Howard Shore,The Twilight Saga: Eclipse The Score,Compromise/Bella's Theme,https://p.scdn.co/mp3-preview/7ae2547deb611dae53a4046396691aaa68328d83?cid=0e18970867524f1fba6634279dd9e5b2,38,0.995,0.699,0.0155,75.935,0.292,0.934,0.133,-20.047,0.0707
208,295,The Highwaymen,Thomas Newman,The Highwaymen (Music From the Netflix Film),The Shame of Arcadia,https://p.scdn.co/mp3-preview/0eb4efba086a3f54b1c7e007d070d4527087f334?cid=0e18970867524f1fba6634279dd9e5b2,20,0.969,0.242,0.0365,126.343,0.0426,0.906,0.0934,-28.394,0.0379
210,298,Creep 2,Julian Wass,Creep 2 (Music from the Motion Picture),Sara Loves Her Juicy Fruit,https://p.scdn.co/mp3-preview/86238030b931ac741a36dc2733ddc50cb74de545?cid=0e18970867524f1fba6634279dd9e5b2,36,0.884,0.739,0.726,116.032,0.679,0.147,0.0872,-4.854,0.0407
212,300,Unrest,Bear McCreary,Unrest (Original Motion Picture Soundtrack),Patience,https://p.scdn.co/mp3-preview/82885627174a491ca8084e19207cf64e8b01bb61?cid=0e18970867524f1fba6634279dd9e5b2,16,0.333,0.569,0.273,81.41,0.235,0,0.127,-16.303,0.278
213,306,Blue Jay,Julian Wass,Blue Jay (Original Motion Picture Soundtrack),Marcescence,https://p.scdn.co/mp3-preview/783c0e748ee97e71e7cdcf4355ae6c291e08fe3a?cid=0e18970867524f1fba6634279dd9e5b2,6,0.958,0.276,0.043,63.45,0.0782,0.918,0.0972,-29.739,0.0371
214,307,1922,Mike Patton,1922 (Original Motion Picture Soundtrack),Murder Is Work,https://p.scdn.co/mp3-preview/220989c270e6e1240220e796ea43f4b9990ab112?cid=0e18970867524f1fba6634279dd9e5b2,1,0.875,0.571,0.0797,82.579,0.0646,0.908,0.121,-15.202,0.144
